{
  "artifact": "LOCUS-security-matrix-v2",
  "predecessor": {
    "artifact": "LOCUS-security-matrix-v1",
    "sha256": "bdeb5cb1e0992c08e44e6bf4a47b6071952ad56474124613aaae81664f18cf89",
    "preserved_claim_ids": [
      "C01",
      "C02",
      "C03",
      "C04",
      "C05",
      "C06",
      "C07",
      "C08",
      "C09",
      "C10",
      "C11",
      "C12",
      "C13",
      "C14",
      "C15",
      "C16",
      "C17",
      "C18",
      "C19",
      "C20",
      "C21",
      "C22",
      "C23",
      "C24",
      "C25",
      "C26"
    ]
  },
  "phases": [
    "bootstrap",
    "client-lifecycle",
    "credential-reset",
    "enrollment",
    "package-export",
    "package-import",
    "party-replacement",
    "persistent-state-disposal",
    "recovery",
    "successor-publication",
    "system-control"
  ],
  "views": [
    "application-storage-gateway",
    "below-threshold-party-coalition",
    "clean-client-after-cue-entry",
    "clean-client-before-cue-entry",
    "cloud",
    "container-controller",
    "credential-state",
    "descriptor-store",
    "docker-engine-metadata",
    "enrollment-client-after-disposal",
    "exact-threshold-appss-coalition",
    "identity-admission-provider",
    "managed-client-active-browser",
    "managed-client-after-destruction",
    "managed-client-after-process-reset",
    "manager-ui-api",
    "matching-combined-state",
    "network-role-metadata",
    "recovery-package",
    "resolver"
  ],
  "managed_contracts": [
    {
      "contract_id": "M01",
      "phases": ["client-lifecycle", "system-control"],
      "views": ["container-controller", "docker-engine-metadata", "manager-ui-api", "network-role-metadata"],
      "asset": "Exact-project container lifecycle authority, fixed service/client inventory, and separation of browser, Manager, controller, and Docker-engine reachability.",
      "adversary": "A forged, replayed, cross-origin, stale, cross-project, or arbitrary-specification request attempting to control an unapproved container or reach the Docker engine through a UI.",
      "assumptions": "The same-host operator trusts the dedicated root-equivalent controller and Docker engine; loopback browser access is single-operator research access, not production multi-user authentication.",
      "boundary": "The browser reaches the Manager only through host loopback and manager-edge. Manager-to-controller requests use management only; Client self-lifecycle requests use client-lifecycle only. Managed Clients are absent from management and manager-edge, cannot reach the Manager UI/API, and the controller alone mounts the Docker socket. The distinct browser-edge network carries each Client's host-published loopback path and is not a Manager-to-Client network.",
      "positive_control": "One CSRF/origin-valid Manager action on an exact allowlisted project container and one proof-bound Client self-destruction succeed; wrong-project, wrong-instance, replayed, arbitrary-image/command/mount/network/label, and forbidden cross-network controls fail without changing an allowed container.",
      "expected_observation": "Only typed allowlisted actions affect the exact project target, controller status is sanitized, the two lifecycle networks remain disjoint, the two browser-edge networks remain role-specific, and neither UI can contact the Docker socket.",
      "interpretation_limit": "The controller remains root-equivalent same-host operator infrastructure. Network and request checks do not establish independent administration, hostile-local-user isolation, production orchestration security, or availability under Docker-engine compromise."
    },
    {
      "contract_id": "M02",
      "phases": ["enrollment", "package-export", "package-import", "recovery"],
      "views": ["application-storage-gateway", "descriptor-store", "managed-client-active-browser", "recovery-package"],
      "asset": "Encrypted protected-key backup and authenticated public recovery metadata transported in LOCUS-client-recovery-package-v1 without plaintext key, cue, recovery secret, credential, or party state.",
      "adversary": "A malicious package producer or importer supplying oversized, noncanonical, duplicate, unknown, truncated, digest-mismatched, signature-invalid, stale, cross-subject, cross-epoch, or configuration-override bytes, or inducing export of prohibited secret fields.",
      "assumptions": "The installed trust root, operator signatures, authenticated discovery/current pointer, required current-party quorum, strict codec bounds, and existing storage/admission paths remain available and correct.",
      "boundary": "Export admits only the registered bounded envelope over existing authenticated bytes. Import treats every byte and displayed metadata summary as untrusted until canonical decoding, exact length/digest/signature, subject/epoch, discovery/current-pointer, and current-party checks succeed; package metadata cannot override suite, policy, membership, threshold, endpoint, provider, or fallback behavior.",
      "positive_control": "One canonical package round-trips and reaches descriptor-bound recovery; every single malformed/tampered/stale/substituted mutation fails in its bounded category, and a deliberately inserted private-key, cue, credential, verifier, or party-state field is rejected or detected by the export scan.",
      "expected_observation": "Only an authenticated current package reaches recovery, export contains ciphertext plus permitted public metadata only, and recovery still traverses admission, local storage gateway/provider, current state, authorization, and online threshold parties.",
      "interpretation_limit": "The downloaded package is intentionally persistent outside the Client container and its later file handling is a user/browser boundary. It is not cloud-provider integration, an authenticity root by itself, rollback resistance, an offline backup-only recovery path, or evidence of secure deletion."
    },
    {
      "contract_id": "M03",
      "phases": ["client-lifecycle", "persistent-state-disposal", "recovery"],
      "views": ["container-controller", "managed-client-active-browser", "managed-client-after-destruction", "managed-client-after-process-reset"],
      "asset": "Isolation of dynamic Client identities and volatile server-side private-key, proof, export/import cache, operation, and session state across process lifecycle actions and device-loss destruction.",
      "adversary": "Accidental reuse of Client A memory, proof identity, key slot, session/package state, lifecycle token, writable volume, or public instance identity by a restarted process or newly created recovery Client B.",
      "assumptions": "Managed Clients use the fixed read-only template and no client-scoped durable secret volume; downloaded packages are held outside the destroyed container and explicitly re-imported.",
      "boundary": "Client stop gracefully ends the process and kill ends it abruptly; both make the endpoint unavailable while retaining the container, loopback port binding, lifecycle token, and public client ID. A later start, and every restart, creates a fresh process proof identity with an empty server-side key slot, export/import cache, and operation/session set under that same client ID. Destroy removes the exact container and public ID; a later create obtains a distinct client ID, lifecycle token, and proof identity with no inherited Client A state.",
      "positive_control": "A deliberate server-side volatile marker and loaded synthetic key disappear after stop/start, restart, and kill/start while the public client ID remains and proof identity changes; destroy removes the endpoint/container, and a fresh Client B has a new ID/proof identity and rejects an inherited-state marker or another client's self-lifecycle token.",
      "expected_observation": "Every process re-entry begins with an empty key slot and fresh proof identity, destruction removes the exact Client instance, and only explicit package import plus authenticated remote state enables Client B recovery.",
      "interpretation_limit": "Stop, restart, and kill are destructive volatile resets, not session continuity. Container destruction is bounded state isolation rather than forensic erasure; browser downloads, screen capture, host memory, Docker-engine access, and remote party/provider state remain outside this disposal claim."
    },
    {
      "contract_id": "M04",
      "phases": ["client-lifecycle", "enrollment", "package-export", "recovery"],
      "views": ["container-controller", "managed-client-active-browser", "managed-client-after-destruction", "managed-client-after-process-reset", "manager-ui-api", "network-role-metadata", "recovery-package"],
      "asset": "Synthetic plaintext private key and transient cue-derived secret path intentionally exposed only to the active managed Client/browser when the user generates, reveals, or recovers that key.",
      "adversary": "Accidental propagation of the displayed key through Manager/controller APIs, lifecycle messages, package export, service traffic, logs, telemetry, browser storage/history/cache, crash output, screenshots, or later Client processes.",
      "assumptions": "The demonstration uses only generated synthetic keys; the active browser, operating system, and user-visible screen are inside the trusted active-client boundary for the duration of display.",
      "boundary": "The key may appear in the active Client response and DOM only. It is prohibited from Manager/controller data, recovery-package bytes, remote service payloads beyond the existing encrypted/protocol path, durable Client state, browser persistence, logs, crash output, retained screenshots, and evidence. Stop/start, restart, kill/start, and destroy clear the process-local key slot; a newly loaded Client document begins empty.",